11282,1105732990836944048,https://www.airbnb.com/rooms/1105732990836944048,20240900000000.0,23/09/2024,city scrape,Lycabettus 1 bedroom 2 persons apartment by MPS,Modern apartment close to Athens city center with cozy details and fully furnished. It has one bedroom with double bed and a spacious bathroom. The flat is close to Evaggelismos metro station and from there you can explore the whole city.,,https://a0.muscache.com/pictures/miso/Hosting-1105732990836944048/original/6ca7c728-436d-4faf-b5ea-cb84875f1507.jpeg,182156346,https://www.airbnb.com/users/show/182156346,Maryland,03/04/2018,"Athens, Greece","Hello dear travellers, we are Maryland, a professional team and we are here to offer you a five star quality services during your stay. Our passion with hosting is based on a strong relationship between owners and guests and that's a promise.
We are here 24/7 for you, and we always provide a tide room with clean sheets, shampoo and shower gel. If your check in is late don't you worry we've got the solution as always! :)",within an hour,100%,99%,f,https://a0.muscache.com/im/pictures/user/4d8eefde-5b90-4341-bd72-c66f218cbc5f.jpg?aki_policy=profile_small,https://a0.muscache.com/im/pictures/user/4d8eefde-5b90-4341-bd72-c66f218cbc5f.jpg?aki_policy=profile_x_medium,Agios Georgios,138,181,"['email', 'phone']",t,t,,ΛΥΚΑΒΗΤΤΟΣ,,37.9802204,23.7453144,Entire rental unit,Entire home/apt,2,1.0,1 bath,1.0,1.0,"[""TV"", ""Kitchen"", ""Stove"", ""Oven"", ""Self check-in"", ""Washer"", ""Fire extinguisher"", ""Refrigerator"", ""Iron"", ""Air conditioning"", ""Dining table"", ""Hair dryer"", ""Cooking basics"", ""Clothing storage"", ""Essentials"", ""Lockbox"", ""Hot water kettle"", ""Dishes and silverware"", ""Wifi"", ""Hangers""]",$45.00,1,365,1,1,365,365,1.0,365.0,,t,16,46,76,256,23/09/2024,2,2,0,14/04/2024,14/06/2024,3.5,3.5,4.0,5.0,4.0,4.5,3.5,00002532170,t,68,68,0,0,0.37
11294,1106319792316272108,https://www.airbnb.com/rooms/1106319792316272108,20240900000000.0,23/09/2024,city scrape,Athens Studio Nemar,Enjoy a stylish experience at this centrally located place.,,https://a0.muscache.com/pictures/miso/Hosting-1106319792316272108/original/e0b78d3f-a18b-4190-a413-3edc6f795530.jpeg,444906990,https://www.airbnb.com/users/show/444906990,Smart Plan,13/02/2022,"Heraklion, Greece",Management Company,within an hour,100%,100%,,https://a0.muscache.com/im/pictures/user/383107af-18d5-4489-a5d9-fea851da6a01.jpg?aki_policy=profile_small,https://a0.muscache.com/im/pictures/user/383107af-18d5-4489-a5d9-fea851da6a01.jpg?aki_policy=profile_x_medium,Μέσα Καρτερός,199,211,"['email', 'phone']",t,t,,ΜΟΥΣΕΙΟ-ΕΞΑΡΧΕΙΑ-ΝΕΑΠΟΛΗ,,37.98651748005072,23.73488746,Entire rental unit,Entire home/apt,2,1.0,1 bath,1.0,1.0,"[""TV"", ""Shower gel"", ""Kitchen"", ""Wine glasses"", ""Stove"", ""Oven"", ""Coffee maker"", ""Heating"", ""Body soap"", ""Coffee"", ""Fire extinguisher"", ""Baking sheet"", ""Free street parking"", ""Refrigerator"", ""Iron"", ""Air conditioning"", ""Toaster"", ""Bed linens"", ""Dining table"", ""Dedicated workspace"", ""Hair dryer"", ""Cooking basics"", ""Hot water"", ""Clothing storage"", ""Essentials"", ""Hot water kettle"", ""Shampoo"", ""Dishes and silverware"", ""Wifi"", ""Hangers""]",$47.00,1,365,1,1,365,365,1.0,365.0,,t,8,38,68,248,23/09/2024,4,4,0,07/04/2024,09/08/2024,3.75,4.25,5.0,5.0,4.5,4.5,4.25,00004588790,t,26,26,0,0,0.71
11297,1106391661307089741,https://www.airbnb.com/rooms/1106391661307089741,20240900000000.0,23/09/2024,city scrape,*Kolonaki Chic* Minimalist Studio in Athens,"Perfect for both leisure and business travellers, this stylish 1-bedroom apartment in the upscale Kolonaki area is close to all major landmarks and attractions. The residence offers a range of home comforts, including WiFi, a Smart Tv, A/c, a washing machine, and an espresso maker. The open-plan living area features a well-equipped kitchen, a dining table and a bench for added convenience.","This is a wonderful part of downtown Athens that offers proximity to some of the most important landmarks in the world, as well as great options for dining or meeting with business partners and friends. Everything you need, from supermarkets, bakeries and grocery stores to bustling cafes and bars, modern eateries, fancy restaurants and chic shopping, is within fast and easy walking distance. Plus, bus and metro connections are excellent, if you want to venture beyond the city centre – every corner of which is accessible by foot when you feel like taking a leisurely stroll. <br /><br />Highlights<br /><br />Kolonaki Square – the beating heart of Athens’ most prestigious neighbourhood – is a mere 5-minute walk away and so are the area’s high-end boutiques and stores, art galleries, museums, bustling bars and chic restaurants. Acropolis, Plaka and the historical centre are less than 30 mins on foot while Syntagma Square is 1,2 km. <br />Lycabettus Hill – a verdant oasis in the heart of th",https://a0.muscache.com/pictures/prohost-api/Hosting-1106391661307089741/original/9f67f65e-990b-492e-8471-1f2d80f292bc.jpeg,149346682,https://www.airbnb.com/users/show/149346682,MyGreek,06/09/2017,"Athens, Greece","We are thrilled to welcome you to one of our Airbnb apartments in Athens, our goal is to ensure that you have a five-star experience in staying with us. 

We are part of a local fun and exciting hospitality group called MyGreekVacations managing more than 100+ beautifully designed custom-made apartments inspired by our travels and our stays in airbnbs around the world. The experience of meeting so many lovely people along the way is something we particularly enjoy, and the city of Athens is a hub where you can always find things to experience, see and do and we can’t get enough of it.

Our priority is to create a comfortable, relaxing and “home away from home” experience for our guests, a “workation” atmosphere for those who wish to combine business with leisure and to always be readily available and provide as much info and assistance as possible; all the things we value when traveling somewhere new ourselves.

Our home is your home! We treat our guests like lifelong friends and we love to spoil them during their visits.

We hope to see you soon.
",within an hour,98%,100%,f,https://a0.muscache.com/im/pictures/user/77bd868d-22c8-4408-897b-183d04b8b85e.jpg?aki_policy=profile_small,https://a0.muscache.com/im/pictures/user/77bd868d-22c8-4408-897b-183d04b8b85e.jpg?aki_policy=profile_x_medium,Koukaki,32,34,['phone'],t,f,"Athina, Athens, Greece",ΛΥΚΑΒΗΤΤΟΣ,,37.980384155904375,23.746796279032285,Entire rental unit,Entire home/apt,3,1.0,1 bath,1.0,2.0,"[""Shower gel"", ""Kitchen"", ""Wine glasses"", ""Clothing storage: dresser"", ""Heating - split type ductless system"", ""Smoke alarm"", ""Long term stays allowed"", ""Fire extinguisher"", ""Iron"", ""First aid kit"", ""Toaster"", ""Bed linens"", ""Dining table"", ""Safe"", ""Dedicated workspace"", ""Hair dryer"", ""Room-darkening shades"", ""Private Label shampoo"", ""Cooking basics"", ""AC - split type ductless system"", ""43 inch TV with standard cable"", ""Hot water"", ""Microwave"", ""Private label body soap"", ""Essentials"", ""Drying rack for clothing"", ""Mini fridge"", ""Hot water kettle"", ""Carbon monoxide alarm"", ""Single level home"", ""Dishes and silverware"", ""DAEWOO stainless steel induction stove"", ""Stainless steel double oven"", ""Free washer \u2013 In unit"", ""Paid crib - available upon request"", ""Wifi"", ""Hangers""]",$48.00,1,1125,2,3,1125,1125,3.0,1125.0,,t,12,42,72,347,23/09/2024,3,3,0,30/03/2024,07/08/2024,3.67,3.67,3.67,3.67,3.67,3.67,3.67,00002451322,t,23,23,0,0,0.51
11330,1107125170860561297,https://www.airbnb.com/rooms/1107125170860561297,20240900000000.0,23/09/2024,city scrape,Lovely apartment in the center of Athens,"Enjoy your stay in our renovated apt, in one of Athens' most renowned neighborhoods, Thiseio, where the city's attractions and the public transport are within walking distance. You can easily have access to the most important archaelogical monuments of the historical center on foot! Get ready to live like a local and explore the hidden gems of the city!","Situated in Nileos Street, the apartment is just a stroll away from Athen's most vibrant historic sites, museums, food markets, shops, and restaurants. The Museum of Acropolis is 1,4 kilometres away from home.<br />A stone’s throw from the Thiseio park and the city-center as well as from many museums and the Acropolis.The district is a great starting point to take in the city’s sights and sounds.<br />A locality that exudes warm, intimate vibes but one that has retained its historical edge.<br />The apartment is served by Thiseio train station in 5 minutes walking distance and 11 minutes walking distance from kerameikos metro station.",https://a0.muscache.com/pictures/prohost-api/Hosting-1107125170860561297/original/3b4e1a75-aa61-4723-a2da-6ce97c677a00.jpeg,65714690,https://www.airbnb.com/users/show/65714690,Home,04/04/2016,"Athens, Greece","We love Traveling and experiences and this made us a partner of Airbnb! We are happy to host you in our listings, let you choose among the best and the most appropriate place for your vacation and showing you the famous greek Philoxenia (=hospitality).",within an hour,100%,99%,f,https://a0.muscache.com/im/pictures/user/65e201e0-b3fa-4c59-a5d8-3dc0da48c324.jpg?aki_policy=profile_small,https://a0.muscache.com/im/pictures/user/65e201e0-b3fa-4c59-a5d8-3dc0da48c324.jpg?aki_policy=profile_x_medium,Attiki,62,66,"['email', 'phone', 'work_email']",t,t,"Athina, Greece",ΘΗΣΕΙΟ,,37.97462,23.71689,Entire rental unit,Entire home/apt,2,1.0,1 bath,1.0,1.0,"[""TV"", ""Kitchen"", ""Stove"", ""Heating"", ""Host greets you"", ""Washer"", ""Refrigerator"", ""Iron"", ""Air conditioning"", ""Patio or balcony"", ""Toaster"", ""Bed linens"", ""Hair dryer"", ""Cooking basics"", ""Hot water"", ""Microwave"", ""Essentials"", ""Drying rack for clothing"", ""Hot water kettle"", ""Shampoo"", ""Dishes and silverware"", ""Wifi"", ""Hangers""]",$58.00,1,60,1,1,60,60,1.0,60.0,,t,22,52,82,357,23/09/2024,5,5,0,08/04/2024,13/08/2024,3.6,4.0,4.4,5.0,4.4,5.0,4.0,00002495956,t,30,30,0,0,0.89
11334,1107367279788999990,https://www.airbnb.com/rooms/1107367279788999990,20240900000000.0,23/09/2024,city scrape,Athens Central Station SmArtStay,"Welcome to Athens Central Station SmArt Stay, 4-bedroom apartment, recently refreshed and updated (March 2024), located steps from the Athens Central Railway Station and metro. Enjoy spacious rooms, modern amenities, and panoramic city views from spacious balconies, that grace three sides of the building. Perfect for young adventurers, couples, big families, or large groups of friends exploring Athens' vibrant attractions, with easy access to the airport and ferry port.",,https://a0.muscache.com/pictures/miso/Hosting-1107367279788999990/original/13fb454e-82e3-425a-affb-00231baba5d8.jpeg,565921809,https://www.airbnb.com/users/show/565921809,Dusan,07/03/2024,,,,,100%,f,https://a0.muscache.com/defaults/user_pic-50x50.png?v=3,https://a0.muscache.com/defaults/user_pic-225x225.png?v=3,,1,1,"['email', 'phone']",f,t,,ΑΓΙΟΣ ΚΩΝΣΤΑΝΤΙΝΟΣ-ΠΛΑΤΕΙΑ ΒΑΘΗΣ,,37.99187641712769,23.72259523266325,Entire rental unit,Entire home/apt,13,2.0,2 baths,4.0,10.0,"[""Freezer"", ""Rice maker"", ""TV"", ""Shower gel"", ""Kitchen"", ""Elevator"", ""Stove"", ""Body soap"", ""Self check-in"", ""Long term stays allowed"", ""Washer"", ""Free street parking"", ""Refrigerator"", ""Air conditioning"", ""Patio or balcony"", ""Toaster"", ""Bed linens"", ""Dining table"", ""Dedicated workspace"", ""Hair dryer"", ""Room-darkening shades"", ""Books and reading material"", ""Microwave"", ""Essentials"", ""Lockbox"", ""Clothing storage: closet and wardrobe"", ""Exterior security cameras on property"", ""Drying rack for clothing"", ""Hot water kettle"", ""Shampoo"", ""Wifi"", ""Hangers""]",$137.00,2,365,2,2,365,365,2.0,365.0,,t,2,2,2,156,23/09/2024,6,6,0,20/04/2024,21/07/2024,3.83,4.17,4.67,4.33,4.5,4.17,4.0,00002498542,t,1,1,0,0,1.15
11335,1112245533406272011,https://www.airbnb.com/rooms/1112245533406272011,20240900000000.0,23/09/2024,city scrape,Modern Two Bedroom Apartment At Koukaki,"Welcome to our stylish and modern apartment located in the heart of the city! Perfect for couples and friends. Enjoy stunning city views from our private balcony or take a short walk to explore the vibrant neighborhood. With easy access to public transportation and nearby attractions, our apartment is the ideal choice for your stay in the city!",,https://a0.muscache.com/pictures/miso/Hosting-1112245533406272011/original/2cde4fd7-f1b5-425f-91b7-a79174697073.jpeg,567037687,https://www.airbnb.com/users/show/567037687,Mint,14/03/2024,,,within a few hours,100%,100%,f,https://a0.muscache.com/im/pictures/user/062c5cca-2cae-4de1-b80e-90c83faf78b3.jpg?aki_policy=profile_small,https://a0.muscache.com/im/pictures/user/062c5cca-2cae-4de1-b80e-90c83faf78b3.jpg?aki_policy=profile_x_medium,,1,1,"['email', 'phone']",t,t,,ΚΟΥΚΑΚΙ-ΜΑΚΡΥΓΙΑΝΝΗ,,37.96634970574944,23.727721605970807,Entire condo,Entire home/apt,4,1.0,1 bath,2.0,2.0,"[""Private patio or balcony"", ""TV"", ""Clothing storage: wardrobe"", ""Kitchen"", ""Wine glasses"", ""Electric stove"", ""Smoke alarm"", ""Coffee maker"", ""Outdoor furniture"", ""Washer"", ""Fire extinguisher"", ""Central heating"", ""Refrigerator"", ""First aid kit"", ""Iron"", ""Air conditioning"", ""Dedicated workspace"", ""Hair dryer"", ""Hot water"", ""Microwave"", ""Essentials"", ""Drying rack for clothing"", ""Hot water kettle"", ""Dishes and silverware"", ""Bidet"", ""Wifi"", ""Hangers""]",$85.00,2,365,2,2,365,365,2.0,365.0,,t,8,23,53,105,23/09/2024,3,3,1,28/05/2024,24/08/2024,3.33,4.0,3.33,4.0,3.33,4.67,3.33,00002479728,t,1,1,0,0,0.76
11362,1112543899345361951,https://www.airbnb.com/rooms/1112543899345361951,20240900000000.0,23/09/2024,city scrape,Liberal Gazi 4,"Liberal apartments are located in one of the most central spots in Athens, in Keramikos, an area known for its nightlife. The property is 400 meters away from 2 metro stops Keramikos (blue line) and Metaxourgeio (red line). Using the Keramikos line, it is only 1 stop away from the historical center of Athens in Monastiraki. All the rooms are brand new and ready to accommodate our guests.",,https://a0.muscache.com/pictures/miso/Hosting-1112543899345361951/original/63b33118-ead5-40f6-84e3-1baa2dcc5920.jpeg,541226109,https://www.airbnb.com/users/show/541226109,Sarn,10/10/2023,,,within an hour,99%,99%,f,https://a0.muscache.com/im/pictures/user/User-541226109/original/787b89ca-f11a-4812-973f-61085a6b4422.jpeg?aki_policy=profile_small,https://a0.muscache.com/im/pictures/user/User-541226109/original/787b89ca-f11a-4812-973f-61085a6b4422.jpeg?aki_policy=profile_x_medium,,94,96,"['email', 'phone']",t,t,,ΚΕΡΑΜΕΙΚΟΣ,,37.9829647,23.7137096,Entire rental unit,Entire home/apt,2,1.0,1 bath,1.0,1.0,"[""Air conditioning"", ""Body soap"", ""Clothing storage"", ""Essentials"", ""Bed linens"", ""TV"", ""Mini fridge"", ""Hot water kettle"", ""Shampoo"", ""Hair dryer"", ""Shower gel"", ""Room-darkening shades"", ""Courtyard view"", ""Elevator"", ""Hot water"", ""Wifi"", ""Hangers""]",$33.00,2,10,1,2,10,10,1.9,10.0,,t,5,25,55,124,23/09/2024,7,7,0,07/04/2024,11/06/2024,3.86,4.29,3.86,4.71,4.57,3.86,4.29,00002507827,t,93,93,0,0,1.24
11363,1112548666671315228,https://www.airbnb.com/rooms/1112548666671315228,20240900000000.0,23/09/2024,city scrape,Liberal Gazi 5,"Liberal apartments are located in one of the most central spots in Athens, in Keramikos, an area known for its nightlife. The property is 400 meters away from 2 metro stops Keramikos (blue line) and Metaxourgeio (red line). Using the Keramikos line, it is only 1 stop away from the historical center of Athens in Monastiraki. All the rooms are brand new and ready to accommodate our guests.",,https://a0.muscache.com/pictures/miso/Hosting-1112548666671315228/original/e4a7349d-2f0f-46dc-a1b1-b86d0747d636.jpeg,541226109,https://www.airbnb.com/users/show/541226109,Sarn,10/10/2023,,,within an hour,99%,99%,f,https://a0.muscache.com/im/pictures/user/User-541226109/original/787b89ca-f11a-4812-973f-61085a6b4422.jpeg?aki_policy=profile_small,https://a0.muscache.com/im/pictures/user/User-541226109/original/787b89ca-f11a-4812-973f-61085a6b4422.jpeg?aki_policy=profile_x_medium,,94,96,"['email', 'phone']",t,t,,ΚΕΡΑΜΕΙΚΟΣ,,37.98199,23.71267,Entire rental unit,Entire home/apt,2,1.0,1 bath,1.0,1.0,"[""Air conditioning"", ""Body soap"", ""Clothing storage"", ""Essentials"", ""Bed linens"", ""TV"", ""Mini fridge"", ""Hot water kettle"", ""Shampoo"", ""Hair dryer"", ""Shower gel"", ""Room-darkening shades"", ""Courtyard view"", ""Elevator"", ""Hot water"", ""Wifi"", ""Hangers""]",$33.00,2,10,1,2,10,10,1.9,10.0,,t,4,24,54,234,23/09/2024,8,8,0,11/04/2024,11/08/2024,3.88,4.5,4.13,4.75,4.63,4.25,4.13,00002507848,t,93,93,0,0,1.45
11383,1112580798772526028,https://www.airbnb.com/rooms/1112580798772526028,20240900000000.0,23/09/2024,city scrape,Liberal Gazi 32,"Liberal apartments are located in one of the most central spots in Athens, in Keramikos, an area known for its nightlife. The property is 400 meters away from 2 metro stops Keramikos (blue line) and Metaxourgeio (red line). Using the Keramikos line, it is only 1 stop away from the historical center of Athens in Monastiraki. All the rooms are brand new and ready to accommodate our guests.",,https://a0.muscache.com/pictures/miso/Hosting-1112580798772526028/original/dc1ca16c-df08-4a5f-a53b-ac0e232f9dd9.jpeg,541226109,https://www.airbnb.com/users/show/541226109,Sarn,10/10/2023,,,within an hour,99%,99%,f,https://a0.muscache.com/im/pictures/user/User-541226109/original/787b89ca-f11a-4812-973f-61085a6b4422.jpeg?aki_policy=profile_small,https://a0.muscache.com/im/pictures/user/User-541226109/original/787b89ca-f11a-4812-973f-61085a6b4422.jpeg?aki_policy=profile_x_medium,,94,96,"['email', 'phone']",t,t,,ΚΕΡΑΜΕΙΚΟΣ,,37.98188,23.7146,Entire rental unit,Entire home/apt,2,1.0,1 bath,1.0,1.0,"[""Air conditioning"", ""Body soap"", ""Clothing storage"", ""City skyline view"", ""Essentials"", ""Bed linens"", ""TV"", ""Mini fridge"", ""Hot water kettle"", ""Shampoo"", ""Hair dryer"", ""Shower gel"", ""Room-darkening shades"", ""Elevator"", ""Hot water"", ""Wifi"", ""Hangers""]",$33.00,2,10,1,2,10,10,1.9,10.0,,t,2,18,48,228,23/09/2024,9,9,0,09/04/2024,13/06/2024,3.78,4.44,4.0,4.56,4.67,3.78,4.22,00002508122,t,93,93,0,0,1.61
11396,1112597471660709889,https://www.airbnb.com/rooms/1112597471660709889,20240900000000.0,23/09/2024,city scrape,Liberal Gazi 43,"Liberal apartments are located in one of the most central spots in Athens, in Keramikos, an area known for its nightlife. The property is 400 meters away from 2 metro stops Keramikos (blue line) and Metaxourgeio (red line). Using the Keramikos line, it is only 1 stop away from the historical center of Athens in Monastiraki. All the rooms are brand new and ready to accommodate our guests.",,https://a0.muscache.com/pictures/miso/Hosting-1112597471660709889/original/cd4a7761-81cd-48a4-8948-598c1e2c4456.jpeg,541226109,https://www.airbnb.com/users/show/541226109,Sarn,10/10/2023,,,within an hour,99%,99%,f,https://a0.muscache.com/im/pictures/user/User-541226109/original/787b89ca-f11a-4812-973f-61085a6b4422.jpeg?aki_policy=profile_small,https://a0.muscache.com/im/pictures/user/User-541226109/original/787b89ca-f11a-4812-973f-61085a6b4422.jpeg?aki_policy=profile_x_medium,,94,96,"['email', 'phone']",t,t,,ΒΟΤΑΝΙΚΟΣ,,37.9841,23.71343,Entire rental unit,Entire home/apt,3,1.0,1 bath,1.0,1.0,"[""Air conditioning"", ""Body soap"", ""Clothing storage"", ""City skyline view"", ""Essentials"", ""Bed linens"", ""TV"", ""Mini fridge"", ""Hot water kettle"", ""Shampoo"", ""Hair dryer"", ""Shower gel"", ""Room-darkening shades"", ""Elevator"", ""Hot water"", ""Wifi"", ""Hangers""]",$36.00,2,10,1,2,10,10,1.9,10.0,,t,3,20,50,230,23/09/2024,2,2,0,14/04/2024,26/05/2024,3.5,4.0,3.5,4.0,4.0,2.5,3.0,00002508218,t,93,93,0,0,0.37
11583,1119369124592633588,https://www.airbnb.com/rooms/1119369124592633588,20240900000000.0,23/09/2024,city scrape,Modern Hideaway,"Our small studio is located in a quiet neighborhood of Neos Kosmos, just 500 meters from the metro station and 450 meters from the Tram stop. It has a fenced private yard of 25 sq.m., surrounded by trees, with a dining table to enjoy peacefully your meal, a glass of wine, or a coffee!","Neos Kosmos neighborhood is located only one Metro Station from the Acropolis Museum and Acropolis area, many restaurants, coffee shops, and supermarkets, are within a few minutes' walking distance, also Metro Station, bus, and Tram stops are very close can lead you either to the center or either to the closest beaches!!",https://a0.muscache.com/pictures/miso/Hosting-1119369124592633588/original/b4cf1b62-f099-4f35-b844-79e7182f4092.jpeg,180896799,https://www.airbnb.com/users/show/180896799,Κωνσταντινος,27/03/2018,"Athens, Greece","Sygrisis International is a property management company offering guests hotel-level services while also providing the privacy & leisure of a fully equipped holiday home.
We are a hospitality company with a unique hands-on approach and operations focus.",within an hour,77%,93%,f,https://a0.muscache.com/im/pictures/user/db4f9cb5-281b-4f3e-8a41-682c0b535b7e.jpg?aki_policy=profile_small,https://a0.muscache.com/im/pictures/user/db4f9cb5-281b-4f3e-8a41-682c0b535b7e.jpg?aki_policy=profile_x_medium,Pangrati,26,29,"['phone', 'work_email']",t,f,"Athina, Greece",ΝΕΟΣ ΚΟΣΜΟΣ,,37.9595044,23.7304483,Entire condo,Entire home/apt,3,1.0,1 bath,1.0,1.0,"[""Freezer"", ""Smoking allowed"", ""Private backyard \u2013 Fully fenced"", ""Pets allowed"", ""Outdoor dining area"", ""Shower gel"", ""Clothing storage: wardrobe"", ""Kitchen"", ""Wine glasses"", ""Heating - split type ductless system"", ""Mosquito net"", ""Electric stove"", ""Smoke alarm"", ""Body soap"", ""Outdoor furniture"", ""Self check-in"", ""Long term stays allowed"", ""Coffee"", ""Washer"", ""Fire extinguisher"", ""Baking sheet"", ""Free street parking"", ""Refrigerator"", ""Iron"", ""First aid kit"", ""Luggage dropoff allowed"", ""Toaster"", ""Bed linens"", ""Stainless steel single oven"", ""Dining table"", ""Safe"", ""Dedicated workspace"", ""Hair dryer"", ""Room-darkening shades"", ""Cooking basics"", ""AC - split type ductless system"", ""43 inch HDTV with Chromecast, Netflix"", ""Hot water"", ""Microwave"", ""Essentials"", ""Lockbox"", ""Drying rack for clothing"", ""Hot water kettle"", ""Shampoo"", ""Single level home"", ""Dishes and silverware"", ""Extra pillows and blankets"", ""Coffee maker: drip coffee maker"", ""Cleaning products"", ""Wifi"", ""Hangers""]",$36.00,2,90,2,4,90,90,2.1,90.0,,t,23,53,83,263,23/09/2024,1,1,1,04/09/2024,04/09/2024,1.0,2.0,1.0,1.0,3.0,4.0,4.0,00002402495,t,21,21,0,0,1.0
11667,1121811881417907199,https://www.airbnb.com/rooms/1121811881417907199,20240900000000.0,23/09/2024,city scrape,Kipstay Apartments - Two,"Welcome to Kipstay Apartments, your premier choice for accommodation in the heart of vibrant Athens.  Our apartments offer a harmonious blend of modern comfort and traditional charm. Whether you're here for business or leisure, our meticulously designed spaces provide the perfect retreat after a day of exploring ancient landmarks or conducting business in the city. Immerse yourself in the rich culture of Athens while enjoying the convenience of our central location",,https://a0.muscache.com/pictures/prohost-api/Hosting-1121811881417907199/original/b6eaa909-5aa6-40e3-8e09-002ff4a651d9.jpeg,47955192,https://www.airbnb.com/users/show/47955192,Abraham,02/11/2015,,,within a day,100%,56%,f,https://a0.muscache.com/im/pictures/user/6ba585e7-6b06-49a9-9269-389a757911e1.jpg?aki_policy=profile_small,https://a0.muscache.com/im/pictures/user/6ba585e7-6b06-49a9-9269-389a757911e1.jpg?aki_policy=profile_x_medium,,4,4,"['email', 'phone']",t,t,,ΑΝΩ ΚΥΨΕΛΗ,,38.00401340484353,23.739940093254084,Entire rental unit,Entire home/apt,5,1.0,1 bath,2.0,3.0,"[""Air conditioning"", ""Heating"", ""Microwave"", ""Stove"", ""Toaster"", ""Dryer"", ""Bed linens"", ""TV"", ""Host greets you"", ""Washer"", ""Kitchen"", ""Elevator"", ""Dishwasher"", ""Refrigerator"", ""Iron"", ""Wifi""]",$106.00,2,45,2,2,45,45,2.0,45.0,,t,30,60,90,365,23/09/2024,1,1,0,11/07/2024,11/07/2024,3.0,4.0,5.0,5.0,4.0,4.0,2.0,16295700100,f,4,4,0,0,0.4
