9346,948520055352725553,https://www.airbnb.com/rooms/948520055352725553,20240900000000.0,23/09/2024,city scrape,Aretousas apartment,The apartment is located near Panepistimio metro station and 1km from Syntagma square. Steps away is the Lykavitos mountain and Pedion Areos park. Close by you will find all the necessary shops and some of the best restaurants and bars are very close to the property. The apartment is ideal for 2 persons and equipped with all the necessities for your stay.,"Cafe's, restaurants, clothing stores and much more are all in walking distance. Lykavitos is the place to be where it will take you couple of minutes to get to the lift that gets you to the top. Having a walk near panepistimio area will leave you speechless while walking also in Plaka area would be a highlight of you stay.",https://a0.muscache.com/pictures/miso/Hosting-948520055352725553/original/c5bb8137-7d31-410f-a006-125860cee3a9.jpeg,40723282,https://www.airbnb.com/users/show/40723282,Georgios,06/08/2015,"Chania, Greece","Our company has years of experience specializes in turning homes and apartments into the ideal vacation experience for our guests. 
We take care of guest’s appointments, interactions, cleaning and check-ins. We guarantee to take care of your stay while being available 24/7.  We take pride in our problem solving capabilities and our swift action.",within an hour,97%,98%,f,https://a0.muscache.com/im/pictures/user/3b17baab-3025-42c5-968a-ecfbd2b08817.jpg?aki_policy=profile_small,https://a0.muscache.com/im/pictures/user/3b17baab-3025-42c5-968a-ecfbd2b08817.jpg?aki_policy=profile_x_medium,,50,54,"['email', 'phone']",t,f,"Athina, Greece",ΜΟΥΣΕΙΟ-ΕΞΑΡΧΕΙΑ-ΝΕΑΠΟΛΗ,,37.98368,23.74033,Entire rental unit,Entire home/apt,2,1.0,1 bath,1.0,1.0,"[""Air conditioning"", ""TV"", ""Dedicated workspace"", ""Kitchen"", ""First aid kit"", ""Wifi""]",$40.00,2,365,2,2,365,365,2.0,365.0,,t,13,43,73,348,23/09/2024,4,1,0,29/08/2023,29/09/2023,3.75,4.25,4.0,5.0,4.75,4.0,3.75,00002249376,t,12,12,0,0,0.31
9445,958000928334290231,https://www.airbnb.com/rooms/958000928334290231,20240900000000.0,23/09/2024,city scrape,Athens Town Hall -Lycabetous 604,"Art Loft in Athens has accommodations and a shared living room. Among the facilities at this property is an elevator and a shared kitchen, along with free Wifi throughout the property.  It is 100 m from the city center and 5 min walk to Monastiraki square and Plaka. All rooms have air conditioning, soundproofing, a desk, a desk, and a private bathroom with a shower, a hairdryer A microwave, toaster, and refrigerator are also available, as well as a coffee machine and a kettle.",Art decorated rooms in the heart of Athens.With superb view of the town hall and lycabetus hill. Situated 1 minute walk from omonia and 3 minutes from monastiraki. Every room has a private bathroom (not en suite) and a minibar . There is a shared kitchen and living room with laptop and internet connection. All rooms are fully air conditioned and have a flat tv. CHECK IN IS ONLY BY APPOINTMENT,https://a0.muscache.com/pictures/miso/Hosting-958000928334290231/original/6472437b-fac2-4193-b10d-eaa7f7399873.jpeg,528757627,https://www.airbnb.com/users/show/528757627,Kostas,30/07/2023,,,within an hour,100%,28%,f,https://a0.muscache.com/defaults/user_pic-50x50.png?v=3,https://a0.muscache.com/defaults/user_pic-225x225.png?v=3,,6,6,"['email', 'phone']",f,t,"Athina, Greece",ΕΜΠΟΡΙΚΟ ΤΡΙΓΩΝΟ-ΠΛΑΚΑ,,37.9821335,23.7266453,Private room in home,Private room,3,1.0,1 bath,1.0,3.0,"[""Air conditioning"", ""TV"", ""Dedicated workspace"", ""Carbon monoxide alarm"", ""Host greets you"", ""Fire extinguisher"", ""Wifi"", ""Lock on bedroom door"", ""First aid kit"", ""Smoke alarm""]",$54.00,1,365,1,1,365,365,1.0,365.0,,t,30,60,90,270,23/09/2024,1,1,0,23/04/2024,23/04/2024,3.0,4.0,4.0,4.0,4.0,4.0,4.0,00000332626,f,6,0,6,0,0.19
9454,954427225130118545,https://www.airbnb.com/rooms/954427225130118545,20240900000000.0,23/09/2024,city scrape,Nafousa apartment 2,"This unique space has its own style.<br />Located  in Panormo neighborhood and 250m away on the metro station and directly in front of the house there is a bus station connect to the city center<br />Cafes, restaurants, and a lively area are right behind the building which  helps you have a special and enjoyable time.<br />  The apartment is connected to new maintenance 2023 and is specially designed to accommodate the business traveler and is fully equipped with all that one could need for a home away from home experience.<br />The space is on the ground floor of the building and has a small balcony",An active and beautiful neighborhood with a unique selection of cafes and restaurants,https://a0.muscache.com/pictures/hosting/Hosting-954427225130118545/original/89a1a90a-34a1-491c-a9c3-6d3f6e0c1c7d.jpeg,446214701,https://www.airbnb.com/users/show/446214701,Ayoub,21/02/2022,,,within an hour,100%,100%,f,https://a0.muscache.com/im/pictures/user/38d38716-d274-492d-b952-bdaa841d5517.jpg?aki_policy=profile_small,https://a0.muscache.com/im/pictures/user/38d38716-d274-492d-b952-bdaa841d5517.jpg?aki_policy=profile_x_medium,,2,2,"['email', 'phone']",t,t,"Athina, Greece",ΑΜΠΕΛΟΚΗΠΟΙ,,37.99213803338236,23.765927217900757,Entire rental unit,Entire home/apt,2,1.0,1 bath,1.0,1.0,"[""Air conditioning"", ""Smoking allowed"", ""Self check-in"", ""Lockbox"", ""Exterior security cameras on property"", ""Pets allowed"", ""TV"", ""Dedicated workspace"", ""Washer"", ""Kitchen"", ""Wifi""]",$33.00,1,365,1,1,1125,1125,1.0,1125.0,,t,28,58,88,178,23/09/2024,6,5,0,06/09/2023,16/08/2024,3.83,5.0,3.5,4.83,4.5,4.83,3.83,00002277427,f,2,2,0,0,0.47
9467,954852591366256728,https://www.airbnb.com/rooms/954852591366256728,20240900000000.0,23/09/2024,city scrape,Kazi Home 2,"The holiday apartment ""Kazi Home 2"" is located in Athens and is perfect for an unforgettable holiday with your loved ones. The 49 m² property consists of a living room, a kitchen, 1 bedroom and 1 bathroom and can therefore accommodate 4 people. Additional amenities include Wi-Fi, a TV as well as air conditioning. A high chair is also available.<br />The holiday apartment offers a private open terrace for relaxing evenings. Furthermore, the property features a roof garden.",,https://a0.muscache.com/pictures/prohost-api/Hosting-954852591366256728/original/4bda58d9-5dba-4ff1-91dc-6437b29dd9a4.jpeg,513244919,https://www.airbnb.com/users/show/513244919,Holidu,05/05/2023,"Athens, Greece","At Holidu, we're on a mission to make the hosting and booking of vacation rentals free of doubt and full of joy. Find the best accommodation in the most beautiful regions in Greece – from stunning apartments overlooking the sea in Kefalonia to beautiful beach villas in Corfu.  Our team of experts work on the ground in local offices with hosts to ensure they offer high-quality vacation rentals so that guests book with peace of mind and confidence.",within an hour,100%,100%,f,https://a0.muscache.com/im/pictures/user/User-513244919/original/4d4d7d2f-7474-432c-9db4-7d7c23b77dbe.png?aki_policy=profile_small,https://a0.muscache.com/im/pictures/user/User-513244919/original/4d4d7d2f-7474-432c-9db4-7d7c23b77dbe.png?aki_policy=profile_x_medium,,183,269,"['email', 'phone']",t,t,,ΑΓΙΟΣ ΝΙΚΟΛΑΟΣ,,38.0092871,23.7284431,Entire rental unit,Entire home/apt,4,1.0,1 bath,1.0,2.0,"[""Air conditioning"", ""Microwave"", ""Patio or balcony"", ""Essentials"", ""Bed linens"", ""TV"", ""Hair dryer"", ""Kitchen"", ""Coffee maker"", ""Free street parking"", ""Private entrance"", ""Stove"", ""Refrigerator"", ""High chair"", ""Wifi""]",$58.00,1,365,1,2,1,365,1.1,41.3,,t,30,60,90,365,23/09/2024,1,1,0,23/10/2023,23/10/2023,3.0,4.0,4.0,3.0,2.0,3.0,4.0,00002403349,t,4,4,0,0,0.09
9503,957002599115506480,https://www.airbnb.com/rooms/957002599115506480,20240900000000.0,23/09/2024,previous scrape,Nice room near AUEB,"The apartment is located in Kypseli , on the 4th floor, close to various universities, AUEB 10 minutes, many attractions, and also close to public transport, but also to all everyday necessities, such as supermarket, bakery, banks, pharmacies, etc., and entertainment, such as cafes, taverns, restaurants, etc.",,https://a0.muscache.com/pictures/miso/Hosting-957002599115506480/original/823102de-d24f-4522-a5fc-949907a38ee7.jpeg,40921063,https://www.airbnb.com/users/show/40921063,Gerhard,09/08/2015,"Athens, Greece",,within a few hours,100%,91%,f,https://a0.muscache.com/im/pictures/user/48213448-b2d2-477a-b1c8-05a88d4df1bd.jpg?aki_policy=profile_small,https://a0.muscache.com/im/pictures/user/48213448-b2d2-477a-b1c8-05a88d4df1bd.jpg?aki_policy=profile_x_medium,Exarcheia,33,39,"['email', 'phone']",t,t,,ΑΝΩ ΚΥΨΕΛΗ,,38.00667,23.73628,Private room in rental unit,Private room,1,,1.5 baths,,,"[""Clothing storage: closet"", ""Kitchen"", ""Stove"", ""Heating"", ""Long term stays allowed"", ""Cleaning available during stay"", ""Washer"", ""Baking sheet"", ""Refrigerator"", ""Lock on bedroom door"", ""Bed linens"", ""Dining table"", ""Dedicated workspace"", ""Room-darkening shades"", ""Ceiling fan"", ""Cooking basics"", ""Hot water"", ""Microwave"", ""Essentials"", ""Drying rack for clothing"", ""Hot water kettle"", ""Dishes and silverware"", ""Bathtub"", ""Cleaning products"", ""Wifi""]",,3,365,3,3,365,365,3.0,365.0,,t,0,0,0,0,23/09/2024,2,2,0,28/12/2023,14/06/2024,2.5,2.5,2.5,2.0,3.0,1.5,2.5,00002264741,f,23,0,23,0,0.22
9554,964283236136945989,https://www.airbnb.com/rooms/964283236136945989,20240900000000.0,23/09/2024,city scrape,Enchanting Balcony Retreat Located in Kipseli,Enchanting Balcony Retreat Located in Kipseli,"The area:<br /><br />This studio apartment is located in Kypseli, one of the city's most eclectic neighborhoods, just 5km from the Acropolis. From its diverse architectural style to its multicultural and bohemian offerings, this remarkable area is one of Athens' oldest districts. In recent decades, it's become popular with artists and other creatives. It remains a popular destination for its neoclassical architecture, Bauhaus designs, lovely squares, and multicultural vibe. If you love art and an eclectic atmosphere, you'll love Kypseli. You'll also appreciate the close proximity of Athens' cultural and ancient sites.",https://a0.muscache.com/pictures/prohost-api/Hosting-964283236136945989/original/561e8f67-369b-415a-854d-72569076fe71.jpeg,468848140,https://www.airbnb.com/users/show/468848140,Michail,11/07/2022,,,within an hour,100%,96%,f,https://a0.muscache.com/im/pictures/user/20e2e658-e407-4b80-bc3e-7e6a7bff3e4f.jpg?aki_policy=profile_small,https://a0.muscache.com/im/pictures/user/20e2e658-e407-4b80-bc3e-7e6a7bff3e4f.jpg?aki_policy=profile_x_medium,,4,10,"['email', 'phone']",t,t,"Athina, Greece",ΚΥΨΕΛΗ,,37.9994395,23.7392732,Entire rental unit,Entire home/apt,3,1.0,1 bath,2.0,2.0,"[""Air conditioning"", ""Patio or balcony"", ""Essentials"", ""Toaster"", ""Long term stays allowed"", ""Bed linens"", ""TV"", ""Shampoo"", ""Hair dryer"", ""Kitchen"", ""Dishes and silverware"", ""Coffee maker"", ""Cooking basics"", ""Oven"", ""Stove"", ""Refrigerator"", ""Wifi""]",$48.00,2,345,2,4,345,345,3.8,345.0,,t,0,0,0,0,23/09/2024,2,2,0,27/09/2023,03/10/2023,2.5,3.5,3.0,4.0,3.5,4.5,2.5,00000182641,t,3,3,0,0,0.17
9556,964314810251265742,https://www.airbnb.com/rooms/964314810251265742,20240900000000.0,23/09/2024,city scrape,CityLiv Studio by LobbySquare,"Our CityLiv Studio is located in the area of Pagkrati, Athens. <br /><br />Offering a 15 minute ride to the heart of Athens as well as connecting with the Airport in less than an hour. <br /><br />In the surrounding area, you can find cafés and restaurants for all tastes and needs, offering plenty of options for a lunch-break during your exploration of Athens or to enjoy a great dinner at night. <br /><br />Our apartment will be a great option for your accommodation either if you travel for business or pleasure.",,https://a0.muscache.com/pictures/miso/Hosting-964314810251265742/original/9b18f1ec-f04b-46ea-b6e5-44fd73addce0.jpeg,394501992,https://www.airbnb.com/users/show/394501992,Ioannis,28/03/2021,"Athens, Greece",,within an hour,100%,100%,t,https://a0.muscache.com/im/pictures/user/b64234e2-70f4-4456-bb32-bdd5a5a08ce8.jpg?aki_policy=profile_small,https://a0.muscache.com/im/pictures/user/b64234e2-70f4-4456-bb32-bdd5a5a08ce8.jpg?aki_policy=profile_x_medium,,35,36,"['email', 'phone']",t,t,,ΓΟΥΒΑ,,37.9595584,23.741551,Entire rental unit,Entire home/apt,2,1.0,1 bath,1.0,1.0,"[""Air conditioning"", ""TV"", ""Outdoor dining area"", ""Washer"", ""Kitchen"", ""Wifi""]",$40.00,1,365,1,1,365,365,1.0,365.0,,t,13,37,67,337,23/09/2024,3,2,0,12/09/2023,12/12/2023,3.67,4.33,4.0,4.67,4.67,4.0,3.67,00002256030,t,31,31,0,0,0.24
9584,973018044795369852,https://www.airbnb.com/rooms/973018044795369852,20240900000000.0,23/09/2024,previous scrape,2-bedroom Atelier apartment near the center,"There are 2 comfortable queen-sized beds, providing a restful night's sleep for solo travelers, friends, families or couples. Located close to Attiki metro station, you'll find an array of shops, supermarkets, and boutiques within walking distance. Immerse yourself in the local culture by visiting nearby attractions such as the Acropolis, Plaka, and Monastiraki Square.","Agias Nikolas is the perfect place for those seeking the ideal combination of city conveniences and a serene natural atmosphere. This neighborhood is located in a lovely suburb of Athens and offers residents and visitors numerous advantages.<br />One of the main benefits of Agias Nikolas is its convenient location. Just a few minutes' walk from the area, you'll find the metro, providing easy access to the main attractions and business districts of Athens. You'll be able to quickly reach historical sites, museums, restaurants, and shops.<br />Surrounded by stunning nature, Agias Nikolas offers amazing views of the surrounding mountains and sea. You can enjoy walks along picturesque trails, visit local parks and green spaces, and spend time outdoors with family and friends.",https://a0.muscache.com/pictures/miso/Hosting-973018044795369852/original/5fb67056-6331-4ba4-acfb-76017439ca05.jpeg,520807652,https://www.airbnb.com/users/show/520807652,Golden Bridge,19/06/2023,"Athens, Greece",,within an hour,100%,100%,f,https://a0.muscache.com/im/pictures/user/User-520807652/original/3ba4eafd-dc96-479f-b642-773577d0c9bb.jpeg?aki_policy=profile_small,https://a0.muscache.com/im/pictures/user/User-520807652/original/3ba4eafd-dc96-479f-b642-773577d0c9bb.jpeg?aki_policy=profile_x_medium,,21,24,"['email', 'phone']",t,t,"Athina, Greece",ΠΛΑΤΕΙΑ ΑΜΕΡΙΚΗΣ,,38.0030116,23.7274435,Entire rental unit,Entire home/apt,6,,1 bath,2.0,,"[""Freezer"", ""Private patio or balcony"", ""Pets allowed"", ""TV"", ""Outdoor dining area"", ""Clothing storage: closet"", ""Shower gel"", ""Kitchen"", ""Wine glasses"", ""Elevator"", ""Oven"", ""Smoke alarm"", ""Coffee maker"", ""Heating"", ""Body soap"", ""Outdoor furniture"", ""Self check-in"", ""Long term stays allowed"", ""Cleaning available during stay"", ""Crib - available upon request"", ""Coffee"", ""Washer"", ""Induction stove"", ""Free street parking"", ""Refrigerator"", ""Air conditioning"", ""Bed linens"", ""Dining table"", ""Dedicated workspace"", ""Cooking basics"", ""Hot water"", ""Microwave"", ""Essentials"", ""Lockbox"", ""Hot water kettle"", ""Shampoo"", ""Dishes and silverware"", ""Cleaning products"", ""Wifi"", ""Hangers""]",,2,365,2,2,365,365,2.0,365.0,,t,0,0,0,0,23/09/2024,4,3,0,22/09/2023,24/06/2024,3.5,4.0,3.75,5.0,4.5,4.0,3.5,00002012893,t,19,19,0,0,0.33
9644,978129865868726333,https://www.airbnb.com/rooms/978129865868726333,20240900000000.0,23/09/2024,city scrape,Glamorous Apt in central Athens!,"This sleek, sophisticated apartment in central Athens makes an excellent base to explore Athens. It is well-appointed and comfortably accommodates five guests. The nearest Metro station is a short walk away. If you're in town for an Athens Concert Hall performance is also minutes away.","The area:<br /><br />The ancient Greek world surrounds this apartment in the city's central northeast. It is situated in a residential area convenient to many prominent landmarks or points of interest. Athens Music Hall, Nicholas P. Goulandris Foundation - Museum of Cycladic Art, Lycabettus Hill, and the Benaki Museum are nearby. Syntagma Square, Athens' central square, is two short stops away on the Metro.<br /><br /><br /><br />The charming and upscale district of Kolonaki is about a 15-minute walk - a must-see area. You'll find numerous cafes, restaurants, and upscale boutiques. Don't miss Kolonaki Square while there! <br /><br /><br /><br />Don't miss the trendy, cultural neighborhoods of Gazi and Psyrri with their excellent local tavernas, pubs, and open-air cafés.  <br /><br /><br /><br />The port of Piraeus, a charming and ancient port city known for its seafood restaurants and ferries to the Greek islands, is about 7-8 km.<br /><br /><br /><br />The international airport is 13 ",https://a0.muscache.com/pictures/prohost-api/Hosting-978129865868726333/original/fb2951d2-3c84-4cbe-9391-2a5afe5d90f2.jpeg,480125787,https://www.airbnb.com/users/show/480125787,Nikolaos,19/09/2022,,,,,100%,f,https://a0.muscache.com/im/pictures/user/6d5b6135-7475-4ab2-819d-873bc3b08af7.jpg?aki_policy=profile_small,https://a0.muscache.com/im/pictures/user/6d5b6135-7475-4ab2-819d-873bc3b08af7.jpg?aki_policy=profile_x_medium,,4,8,['phone'],t,t,"Athina, Greece",ΚΟΛΩΝΑΚΙ,,37.9777418,23.7507307,Entire rental unit,Entire home/apt,5,1.0,1 bath,2.0,3.0,"[""Patio or balcony"", ""Essentials"", ""Long term stays allowed"", ""Bed linens"", ""Hot water kettle"", ""Shampoo"", ""Hair dryer"", ""Kitchen"", ""Dishes and silverware"", ""Coffee maker"", ""Elevator"", ""Oven"", ""Private entrance"", ""Stove"", ""Refrigerator"", ""Iron"", ""Wifi""]",$153.00,2,363,4,4,363,363,4.0,363.0,,t,0,22,52,327,23/09/2024,3,3,0,20/10/2023,21/11/2023,2.0,2.33,1.67,2.33,3.0,3.33,2.0,00000102640,t,3,3,0,0,0.26
9645,978130117421204580,https://www.airbnb.com/rooms/978130117421204580,20240900000000.0,23/09/2024,city scrape,Brand new 1 Bd Apt in Kolonaki,Brand new 1 Bd Apt in Kolonaki,,https://a0.muscache.com/pictures/prohost-api/Hosting-978130117421204580/original/5a1550e1-7a21-4fe5-815d-43f77a5a77a4.jpeg,480125787,https://www.airbnb.com/users/show/480125787,Nikolaos,19/09/2022,,,,,100%,f,https://a0.muscache.com/im/pictures/user/6d5b6135-7475-4ab2-819d-873bc3b08af7.jpg?aki_policy=profile_small,https://a0.muscache.com/im/pictures/user/6d5b6135-7475-4ab2-819d-873bc3b08af7.jpg?aki_policy=profile_x_medium,,4,8,['phone'],t,t,,ΚΟΛΩΝΑΚΙ,,37.9777418,23.7507307,Entire rental unit,Entire home/apt,3,1.0,1 bath,1.0,2.0,"[""Essentials"", ""Long term stays allowed"", ""Bed linens"", ""TV"", ""Hot water kettle"", ""Shampoo"", ""Kitchen"", ""Dishes and silverware"", ""Coffee maker"", ""Elevator"", ""Stove"", ""Refrigerator"", ""Wifi""]",$89.00,2,345,4,4,345,345,4.0,345.0,,t,0,22,52,327,23/09/2024,1,1,0,12/12/2023,12/12/2023,2.0,2.0,2.0,4.0,3.0,4.0,2.0,00000182573,t,3,3,0,0,0.1
9646,978130311314618005,https://www.airbnb.com/rooms/978130311314618005,20240900000000.0,23/09/2024,city scrape,Classic Retire with Outstanding Lycabettus View,Classic Retire with Outstanding Lycabettus View,,https://a0.muscache.com/pictures/prohost-api/Hosting-978130311314618005/original/52eb4f4b-3410-4556-a151-9c23198886c8.jpeg,480125787,https://www.airbnb.com/users/show/480125787,Nikolaos,19/09/2022,,,,,100%,f,https://a0.muscache.com/im/pictures/user/6d5b6135-7475-4ab2-819d-873bc3b08af7.jpg?aki_policy=profile_small,https://a0.muscache.com/im/pictures/user/6d5b6135-7475-4ab2-819d-873bc3b08af7.jpg?aki_policy=profile_x_medium,,4,8,['phone'],t,t,,ΚΟΛΩΝΑΚΙ,,37.9777418,23.7507307,Entire rental unit,Entire home/apt,2,1.0,1 bath,1.0,1.0,"[""Patio or balcony"", ""Essentials"", ""Long term stays allowed"", ""Bed linens"", ""TV"", ""Hot water kettle"", ""Shampoo"", ""Dishes and silverware"", ""Coffee maker"", ""Elevator"", ""Stove"", ""Refrigerator"", ""Wifi""]",$83.00,2,345,4,4,345,345,4.0,345.0,,t,22,52,82,357,23/09/2024,2,2,0,29/05/2024,09/06/2024,1.5,1.0,3.0,2.0,2.5,3.0,2.0,00000162524,t,3,3,0,0,0.51
9663,978841417430796691,https://www.airbnb.com/rooms/978841417430796691,20240900000000.0,23/09/2024,city scrape,Yellow butterfly,Maintain simplicity in this quiet and strategic housing.<br /><br />It is located in the center of the city and is close to several stations and from it to the airport,"A nice, quiet neighborhood that's close to everything<br />Transportation, Markets, Restaurants, Museums......",https://a0.muscache.com/pictures/6555676e-b295-4a79-b634-1b687fa3f4e3.jpg,395532031,https://www.airbnb.com/users/show/395532031,Φάρες,04/04/2021,"Athens, Greece",,within a day,50%,100%,f,https://a0.muscache.com/im/pictures/user/a25344ee-1d19-4c40-b659-10f7fce6ab08.jpg?aki_policy=profile_small,https://a0.muscache.com/im/pictures/user/a25344ee-1d19-4c40-b659-10f7fce6ab08.jpg?aki_policy=profile_x_medium,,1,1,"['email', 'phone']",t,t,"Athina, Greece",ΠΛΑΤΕΙΑ ΑΤΤΙΚΗΣ,,37.9941194,23.7241729,Private room in condo,Private room,1,1.5,1.5 shared baths,1.0,1.0,"[""Kitchen"", ""Blender"", ""Ethernet connection"", ""Coffee maker: Nespresso"", ""Host greets you"", ""Central heating"", ""Free street parking"", ""Refrigerator"", ""Lock on bedroom door"", ""Paid washer \u2013 In unit"", ""Gas stove"", ""Dedicated workspace"", ""Room-darkening shades"", ""Cooking basics"", ""Hot water"", ""Portable fans"", ""Microwave"", ""Drying rack for clothing"", ""Hot water kettle"", ""Single level home"", ""Dishes and silverware"", ""Stainless steel double oven"", ""Wifi""]",$41.00,1,180,1,1,180,180,1.0,180.0,,t,30,60,90,90,23/09/2024,3,2,0,14/09/2023,12/06/2024,3.67,4.33,3.33,4.0,4.33,3.0,4.0,2870061,f,1,0,1,0,0.24
9665,975948862545172454,https://www.airbnb.com/rooms/975948862545172454,20240900000000.0,23/09/2024,city scrape,Syntagma Suite 2,"Enjoy a stylish experience at this centrally-located place.<br />Apartment of the floor, 30 sq.m. in the center of Athens for a comfortable stay for up to two (2) people. Features 1 double bed in the bedroom. The suite is fully renovated, furnished and equipped with linens, furniture, appliances, and home goods.",,https://a0.muscache.com/pictures/hosting/Hosting-U3RheVN1cHBseUxpc3Rpbmc6OTc1OTQ4ODYyNTQ1MTcyNDU0/original/913e9306-936d-44f2-962a-356cfa0d5607.jpeg,389089363,https://www.airbnb.com/users/show/389089363,Michos Monoprosopi Ike,18/02/2021,,,within an hour,100%,100%,f,https://a0.muscache.com/im/pictures/user/5eca7dd9-935a-4ce1-bbec-e3e75675545d.jpg?aki_policy=profile_small,https://a0.muscache.com/im/pictures/user/5eca7dd9-935a-4ce1-bbec-e3e75675545d.jpg?aki_policy=profile_x_medium,Koukaki,19,21,"['email', 'phone', 'work_email']",t,t,,ΕΜΠΟΡΙΚΟ ΤΡΙΓΩΝΟ-ΠΛΑΚΑ,,37.97584,23.72939,Entire rental unit,Entire home/apt,2,1.0,1 bath,1.0,1.0,"[""TV"", ""Shower gel"", ""Resort access"", ""Heating"", ""Coffee maker: espresso machine"", ""Host greets you"", ""Refrigerator"", ""Iron"", ""Dedicated workspace"", ""Hair dryer"", ""Room-darkening shades"", ""Fast wifi \u2013 89 Mbps"", ""Hot water"", ""High chair"", ""City skyline view"", ""Essentials"", ""Central air conditioning"", ""Mini fridge"", ""Shampoo"", ""Paid pack \u2019n play/travel crib""]",$90.00,2,365,1,2,1125,1125,1.2,1125.0,,t,24,54,61,62,23/09/2024,6,5,0,17/09/2023,26/10/2023,3.83,4.0,3.83,4.0,3.67,4.83,4.0,00002301609,t,18,18,0,0,0.48
9678,979351686708585287,https://www.airbnb.com/rooms/979351686708585287,20240900000000.0,23/09/2024,city scrape,"As Athens Central Studio ""1A""","An apartment in the heart of the historic center of Athens, 500 meters from Monastiraki. It is ideal for couples, but also for families...<br /><br />Bikes are available for rent.",,https://a0.muscache.com/pictures/miso/Hosting-979351686708585287/original/bb1cc3c3-67af-495b-829d-927298e6e96c.png,57151032,https://www.airbnb.com/users/show/57151032,Aris,02/02/2016,"Athens, Greece",,within an hour,100%,91%,f,https://a0.muscache.com/im/pictures/user/e4ca5bd1-aa42-4143-8715-7bcc0e6cb5e2.jpg?aki_policy=profile_small,https://a0.muscache.com/im/pictures/user/e4ca5bd1-aa42-4143-8715-7bcc0e6cb5e2.jpg?aki_policy=profile_x_medium,Plaka,8,8,"['email', 'phone']",t,t,,ΕΜΠΟΡΙΚΟ ΤΡΙΓΩΝΟ-ΠΛΑΚΑ,,37.9796167,23.7270387,Entire condo,Entire home/apt,4,1.0,1 bath,0.0,1.0,"[""Crib"", ""TV"", ""Kitchen"", ""Elevator"", ""Pack \u2019n play/Travel crib"", ""Stove"", ""Oven"", ""Smoke alarm"", ""Coffee maker"", ""Heating"", ""Self check-in"", ""Long term stays allowed"", ""Fire extinguisher"", ""Refrigerator"", ""First aid kit"", ""Iron"", ""Air conditioning"", ""Bed linens"", ""Hair dryer"", ""Cooking basics"", ""Hot water"", ""Essentials"", ""Lockbox"", ""Carbon monoxide alarm"", ""Shampoo"", ""Single level home"", ""Dishes and silverware"", ""Wifi"", ""Hangers""]",$40.00,1,365,2,2,365,365,2.0,365.0,,t,15,40,70,248,23/09/2024,7,7,1,09/10/2023,03/09/2024,3.86,4.29,3.71,4.43,4.57,4.86,4.0,00002569408,t,6,6,0,0,0.6
