6977,730374223382714618,https://www.airbnb.com/rooms/730374223382714618,20240900000000.0,23/09/2024,city scrape,Ermou Studio,"Right in the very business and shopping centre of Athens, overlooking Ermou Str, 50 m. from Syntagma Square, 50 m. from the historical centre of Athens (Plaka, Monastiraki, Thiseio) and within walking distance from the Acropolis, it's the perfect urban spot, and yet homey; this spacious studio apartment is equally ideal both for those who visit Athens for the first time, close to all landmark sightseeings, and business people and digital nomads who wish to be in the centre of things.","Ermou Street (Greek: Οδός Ερμού, Odos Ermou, ""Hermes Street"") is a one and a half kilometer-long road in central Athens, Greece, connecting Kerameikos archaeological site with the Syntagma Square through Monastiraki, Psiri and Thiseio.<br /><br />With fashion shops and shopping centres promoting most international brands, it is in the top five most expensive shopping streets in Europe, and the tenth most expensive retail street in the world.<br /><br />Its bustling sidewalks are lined with large stores, boutique designer shops, little snack bars and coffee shops.<br /><br />As part of the redesigned city plan drawn up in 1833, Ermou Street was to become the main thoroughfare of modern Athens. However, the course of the street was blocked by the Kapnikarea Church, which is located approximately in the middle of Ermou Street. Therefore it was to be demolished in 1834. Eventually, however, Ludwig von Bayern was able to convince his son Otto, the king of Greece, that the church was of grea",https://a0.muscache.com/pictures/miso/Hosting-730374223382714618/original/ccba2111-7656-4d73-94aa-dec34f157c63.jpeg,482209601,https://www.airbnb.com/users/show/482209601,Despina,04/10/2022,,,,,,f,https://a0.muscache.com/im/pictures/user/80817d99-360c-43fe-b744-3cece8ed8217.jpg?aki_policy=profile_small,https://a0.muscache.com/im/pictures/user/80817d99-360c-43fe-b744-3cece8ed8217.jpg?aki_policy=profile_x_medium,,1,1,"['email', 'phone']",t,t,"Athens, Attiki, Greece",ΕΜΠΟΡΙΚΟ ΤΡΙΓΩΝΟ-ΠΛΑΚΑ,,37.97676,23.73391,Entire condo,Entire home/apt,3,1.5,1.5 baths,1.0,4.0,"[""Smoking allowed"", ""Shower gel"", ""Clothing storage: wardrobe"", ""Elevator"", ""Wifi \u2013 16 Mbps"", ""Body soap"", ""Self check-in"", ""Coffee maker: Nespresso"", ""Coffee"", ""Fire extinguisher"", ""Iron"", ""Window AC unit"", ""Bed linens"", ""Dedicated workspace"", ""Hair dryer"", ""Room-darkening shades"", ""Hot water"", ""Essentials"", ""Lockbox"", ""Hot water kettle"", ""Mini fridge"", ""Shampoo"", ""Dishes and silverware"", ""32 inch HDTV"", ""Hangers""]",$103.00,2,90,2,2,90,90,2.0,90.0,,t,11,35,65,336,23/09/2024,2,0,0,14/10/2022,26/02/2023,3.5,3.5,3.5,4.5,4.0,5.0,3.5,00001795873,f,1,1,0,0,0.08
7004,742677021219566038,https://www.airbnb.com/rooms/742677021219566038,20240900000000.0,23/09/2024,city scrape,Athens Apartment,"Central Apartment has a patio and is situated in Athens, within just 600 m of National Theatre of Greece and less than 300 meters of Metro Station . Guests benefit from a balcony .<br /><br />Popular points of interest near the apartment include National Archaeological Museum of Athens, Monastiraki Square and University of Athens - Central Building. The nearest airport is Elefthérios Venizélos, 33 km from Central Apartment.","Main neighborhood of Athens , the house is located next to the metro . There are several shops near the house .",https://a0.muscache.com/pictures/miso/Hosting-742677021219566038/original/e8146b9e-b5d4-48b7-b615-0339ddb0f04b.jpeg,181487953,https://www.airbnb.com/users/show/181487953,Nikos,30/03/2018,"Athens, Greece",Athens Central Apartments ,within an hour,100%,89%,f,https://a0.muscache.com/im/pictures/user/e38ec040-6b78-400d-bf95-f5d99a99a0c0.jpg?aki_policy=profile_small,https://a0.muscache.com/im/pictures/user/e38ec040-6b78-400d-bf95-f5d99a99a0c0.jpg?aki_policy=profile_x_medium,,1,1,"['email', 'phone']",t,t,"Athina, Greece",ΑΓΙΟΣ ΚΩΝΣΤΑΝΤΙΝΟΣ-ΠΛΑΤΕΙΑ ΒΑΘΗΣ,,37.98719404565925,23.72204310801127,Entire condo,Entire home/apt,2,1.0,1 bath,1.0,1.0,"[""Patio or balcony"", ""Smoking allowed"", ""TV"", ""Mini fridge"", ""Carbon monoxide alarm"", ""Coffee maker: espresso machine"", ""Host greets you"", ""Hair dryer"", ""Fire extinguisher"", ""Wine glasses"", ""Hot water"", ""Iron"", ""Sound system with Bluetooth and aux"", ""Smoke alarm"", ""Hangers""]",$19.00,2,14,2,2,1125,1125,2.0,1125.0,,t,15,40,70,345,23/09/2024,23,23,1,26/12/2023,25/08/2024,3.96,4.35,3.78,4.74,4.91,3.22,4.3,00000067570,f,1,1,0,0,2.53
7005,743184230679279693,https://www.airbnb.com/rooms/743184230679279693,20240900000000.0,23/09/2024,city scrape,Cozy penthouse in Exarcheia,"Keep it simple at this peaceful and centrally-located place. Heart of Exarcheia, Lots of nice spots around.",,https://a0.muscache.com/pictures/hosting/Hosting-743184230679279693/original/6dd6be28-9426-4f50-b6cf-f3ab62761732.jpeg,34438907,https://www.airbnb.com/users/show/34438907,Artemis,28/05/2015,"Athens, Greece","Hello and welcome to my profile! I'm Artemis, a traveler and host in Athens. My love for meeting people and exploring new places inspired me to open my home to guests. Hospitality is about creating a welcoming atmosphere. I offer tips on the best local spots and hidden gems. Thank you for considering my place for your stay. I look forward to making your visit to Athens special.",,,,f,https://a0.muscache.com/im/pictures/user/e981cbd9-b908-4a14-95cc-8feee3f022fd.jpg?aki_policy=profile_small,https://a0.muscache.com/im/pictures/user/e981cbd9-b908-4a14-95cc-8feee3f022fd.jpg?aki_policy=profile_x_medium,,25,31,"['email', 'phone', 'work_email']",t,t,,ΑΓΙΟΣ ΚΩΝΣΤΑΝΤΙΝΟΣ-ΠΛΑΤΕΙΑ ΒΑΘΗΣ,,37.98658,23.72861,Entire condo,Entire home/apt,4,1.0,1 bath,1.0,2.0,"[""Pets allowed"", ""Free parking on premises"", ""Shower gel"", ""Kitchen"", ""Body soap"", ""Self check-in"", ""Fire extinguisher"", ""Central heating"", ""Air conditioning"", ""Bed linens"", ""Dedicated workspace"", ""Hair dryer"", ""Room-darkening shades"", ""Cooking basics"", ""Hot water"", ""Essentials"", ""Lockbox"", ""Drying rack for clothing"", ""Clothing storage: closet and dresser"", ""Shampoo"", ""Dishes and silverware"", ""Extra pillows and blankets"", ""Bathtub"", ""Free washer \u2013 In unit"", ""Wifi"", ""Hangers""]",$80.00,1,365,1,3,1125,1125,1.9,1125.0,,t,27,57,87,362,23/09/2024,3,0,0,25/01/2023,19/09/2023,3.67,4.0,3.67,3.67,4.0,4.33,3.67,00001305255,f,5,5,0,0,0.15
7009,743993793742531849,https://www.airbnb.com/rooms/743993793742531849,20240900000000.0,23/09/2024,city scrape,Santorini Stieke! Greek Tradional Style!,,,https://a0.muscache.com/pictures/miso/Hosting-743993793742531849/original/beed2be1-f996-4c45-b142-c89ae473410c.png,484352075,https://www.airbnb.com/users/show/484352075,Daniela,20/10/2022,"Sofia, Bulgaria",,within a day,100%,83%,f,https://a0.muscache.com/im/pictures/user/ed8fbc86-ce77-4ad8-ae5f-2c7c2f73f1c4.jpg?aki_policy=profile_small,https://a0.muscache.com/im/pictures/user/ed8fbc86-ce77-4ad8-ae5f-2c7c2f73f1c4.jpg?aki_policy=profile_x_medium,,3,5,"['email', 'phone']",t,t,,ΜΟΥΣΕΙΟ-ΕΞΑΡΧΕΙΑ-ΝΕΑΠΟΛΗ,,37.98940044673935,23.732895918282008,Entire rental unit,Entire home/apt,2,1.0,1 bath,1.0,1.0,"[""Table corner guards"", ""Freezer"", ""Pets allowed"", ""TV"", ""Babysitter recommendations"", ""Shower gel"", ""Kitchen"", ""Wine glasses"", ""Sound system"", ""Conditioner"", ""Elevator"", ""Electric stove"", ""Smoke alarm"", ""Coffee maker"", ""Heating"", ""Body soap"", ""Ethernet connection"", ""Self check-in"", ""Long term stays allowed"", ""Laundromat nearby"", ""Coffee"", ""Children\u2019s books and toys"", ""Fire extinguisher"", ""Outlet covers"", ""Pack \u2019n play/Travel crib - available upon request"", ""Baking sheet"", ""Free street parking"", ""Private entrance"", ""Refrigerator"", ""Iron"", ""First aid kit"", ""Air conditioning"", ""Toaster"", ""Bed linens"", ""Dining table"", ""Dedicated workspace"", ""Hair dryer"", ""Room-darkening shades"", ""Hot water"", ""Books and reading material"", ""Microwave"", ""Clothing storage"", ""Essentials"", ""Lockbox"", ""Exterior security cameras on property"", ""Drying rack for clothing"", ""Baby safety gates"", ""Mini fridge"", ""Window guards"", ""Carbon monoxide alarm"", ""Shampoo"", ""Children\u2019s dinnerware"", ""Hot water kettle"", ""Extra pillows and blankets"", ""Cleaning products"", ""Wifi"", ""Hangers""]",$48.00,2,1125,2,2,1125,1125,2.0,1125.0,,t,29,59,89,179,23/09/2024,1,1,0,28/05/2024,28/05/2024,1.0,1.0,1.0,4.0,1.0,2.0,1.0,Exempt,f,3,3,0,0,0.25
7010,743994325041241035,https://www.airbnb.com/rooms/743994325041241035,20240900000000.0,23/09/2024,city scrape,&Santorini Style &By National Archeological Museum,"Nothing says romantic getaway like a weekend in our new studio with a gorgeous hammam-style shower bath in the center of Athens, right? Discover the charm of a tiny studio in a magical setting. Not to mention it is very close to the Acropolis! We have you covered with this 35m2 honeymoon-style haven with Romantic atmosphere. Sure to please everyone with luxurious bed linens, rain shower & NETFLIX. This amazing vista is in the trendy area! Close to Metro & food spot","You and your families will be guests in HISTORICAL part of Athens steps from National Archeological Museum /part Greek History, central location of aspects tourist points in Athens Greece<br />From studio to Pireus limani you can catch electrico-its call green line in Athens ,10 min walking to electrico and metro! Traveling to Pireus is about 30 min , depends of your living gate!Don't forged that if your living gate is far a way from Pireus you must to calculate your traveling time half HR.more with aut taxi by walking!<br />Most cheap ways to travel in Athens are by metro and electrico,no mother from airport to studio or from studio to Pireus!<br />.Apartments are located 10-20 min walking to /<br />New York Colleague<br />Aegean College<br />Webmaster Colleague<br />Hellenic American College<br />SCG Epistimiko Kolegio of Greece<br />Mitropolitiko colegio <br />Hellenic Open University of Athens<br />Nathional Technical University of Athens<br />IGRS Athens International College<br /",https://a0.muscache.com/pictures/hosting/Hosting-U3RheVN1cHBseUxpc3Rpbmc6NzQzOTk0MzI1MDQxMjQxMDM1/original/ef142db7-4a0c-43dd-964a-4b4ea9300378.png,484352075,https://www.airbnb.com/users/show/484352075,Daniela,20/10/2022,"Sofia, Bulgaria",,within a day,100%,83%,f,https://a0.muscache.com/im/pictures/user/ed8fbc86-ce77-4ad8-ae5f-2c7c2f73f1c4.jpg?aki_policy=profile_small,https://a0.muscache.com/im/pictures/user/ed8fbc86-ce77-4ad8-ae5f-2c7c2f73f1c4.jpg?aki_policy=profile_x_medium,,3,5,"['email', 'phone']",t,t,"Athina, Greece",ΜΟΥΣΕΙΟ-ΕΞΑΡΧΕΙΑ-ΝΕΑΠΟΛΗ,,37.99132,23.7326,Entire condo,Entire home/apt,4,1.0,1 bath,1.0,2.0,"[""Table corner guards"", ""Freezer"", ""Crib"", ""Pets allowed"", ""Babysitter recommendations"", ""PEPPINO/PROFESHIONAL CARE shampoo"", ""Shower gel"", ""Kitchen"", ""Wine glasses"", ""Conditioner"", ""Elevator"", ""Pack \u2019n play/Travel crib"", ""Children\u2019s books and toys for ages 2-5 years old and 5-10 years old"", ""Mosquito net"", ""Electrolux electric stove"", ""Oven"", ""Smoke alarm"", ""Heating"", ""Self check-in"", ""Long term stays allowed"", ""Laundromat nearby"", ""Board games"", ""Pocket wifi"", ""Coffee maker: espresso machine"", ""Coffee"", ""Fire extinguisher"", ""Baking sheet"", ""Free street parking"", ""Private entrance"", ""Iron"", ""First aid kit"", ""Paid parking off premises"", ""Window AC unit"", ""Toaster"", ""Bed linens"", ""Dining table"", ""Safe"", ""Dedicated workspace"", ""Hair dryer"", ""Room-darkening shades"", ""CROWN refrigerator"", ""Cooking basics"", ""Hot water"", ""MALICIA body soap"", ""32 inch HDTV with Apple TV, Netflix"", ""Books and reading material"", ""Microwave"", ""City skyline view"", ""Essentials"", ""Lockbox"", ""Exterior security cameras on property"", ""Drying rack for clothing"", ""Clothing storage: closet and dresser"", ""Baby safety gates"", ""Window guards"", ""Carbon monoxide alarm"", ""Mini fridge"", ""Children\u2019s dinnerware"", ""Dishes and silverware"", ""Hot water kettle"", ""Extra pillows and blankets"", ""Single level home"", ""Bathtub"", ""Cleaning products"", ""Wifi"", ""Hangers""]",$53.00,2,1125,2,2,1125,1125,2.0,1125.0,,t,29,59,89,364,23/09/2024,6,4,0,15/01/2023,14/04/2024,3.83,3.83,4.5,4.0,3.83,4.5,3.67,Exempt,f,3,3,0,0,0.29
7063,752097262161324064,https://www.airbnb.com/rooms/752097262161324064,20240900000000.0,23/09/2024,city scrape,Deluxe junior suite in the historical centre,"Located in the lively neighborhood of Psiri full of unique designed taverns, bars, cafes, candy shops and restaurants.","Located in the lively neighborhood of Psiri full of unique designed taverns, bars, cafes, candy shops and restaurants (which are open almost all day long).",https://a0.muscache.com/pictures/miso/Hosting-752097262161324064/original/d99a6c6f-ba42-4baf-8270-05477470b38d.jpeg,485775494,https://www.airbnb.com/users/show/485775494,Aeiphoria Suites And Rooms,31/10/2022,Greece,"Our philosophy is ""whenever you travel abroad, live like a local, not a visitor!""

We always enjoyed traveling around the world and learning about other cultures.

First came our fascination to meet people around the globe, exchange stories and see our city in different ways through their eyes. This fueled a desire to create “aeiphoria” suites into the historical centre of Athens and yet far enough from the hustle and bustleat. 
The studios are exactly as described and in a superb location, in the  heart of the city.

We strongly believe that we can relate to very different types of people and help them experience Greek hospitality, giving priority to high standards of accomodation and attending to the needs and expectations of guests!

We consider each one of you our guests and not customers. 
We will be very happy to give you recommendations during your stay, in order to feel ""local"". And of course to support you when you are exploring Athens. 

Aiming to continiously improve the holiday experience of our guests....let us be your host! 
",within an hour,100%,100%,t,https://a0.muscache.com/im/pictures/user/2407bf04-7f95-4d02-8dbe-4b1ac2b9cd58.jpg?aki_policy=profile_small,https://a0.muscache.com/im/pictures/user/2407bf04-7f95-4d02-8dbe-4b1ac2b9cd58.jpg?aki_policy=profile_x_medium,,4,8,"['email', 'phone']",t,t,"Athina, Greece",ΕΜΠΟΡΙΚΟ ΤΡΙΓΩΝΟ-ΠΛΑΚΑ,,37.98235,23.72481,Entire rental unit,Entire home/apt,4,1.0,1 bath,1.0,3.0,"[""Freezer"", ""Shower gel"", ""Kitchen"", ""Wine glasses"", ""Elevator"", ""Mosquito net"", ""Electric stove"", ""Smoke alarm"", ""Coffee maker"", ""Heating"", ""Body soap"", ""Self check-in"", ""Long term stays allowed"", ""Laundromat nearby"", ""Coffee"", ""Fire extinguisher"", ""Refrigerator"", ""Iron"", ""First aid kit"", ""Paid parking off premises"", ""Bed linens"", ""Dining table"", ""Dedicated workspace"", ""Hair dryer"", ""Room-darkening shades"", ""Cooking basics"", ""43 inch TV with standard cable"", ""Hot water"", ""Clothing storage"", ""Essentials"", ""Central air conditioning"", ""Exterior security cameras on property"", ""Hot water kettle"", ""Carbon monoxide alarm"", ""Shampoo"", ""Dishes and silverware"", ""Extra pillows and blankets"", ""Keypad"", ""Cleaning products"", ""Wifi"", ""Hangers""]",$79.00,1,365,1,1,365,365,1.0,365.0,,t,20,50,80,355,23/09/2024,1,0,0,04/12/2022,04/12/2022,3.0,5.0,4.0,5.0,5.0,5.0,5.0,00001660669,t,4,4,0,0,0.05
7074,752130474219982853,https://www.airbnb.com/rooms/752130474219982853,20240900000000.0,23/09/2024,city scrape,Deluxe double room in the historical centre,"Located in the lively neighborhood of Psiri full of unique designed taverns, bars, cafes, candy shops and restaurants.","Located in the lively neighborhood of Psiri full of unique designed taverns, bars, cafes, candy shops and restaurants (which are open almost all day long).",https://a0.muscache.com/pictures/miso/Hosting-752130474219982853/original/6dae98e3-e321-4872-8456-db905193529d.jpeg,485775494,https://www.airbnb.com/users/show/485775494,Aeiphoria Suites And Rooms,31/10/2022,Greece,"Our philosophy is ""whenever you travel abroad, live like a local, not a visitor!""

We always enjoyed traveling around the world and learning about other cultures.

First came our fascination to meet people around the globe, exchange stories and see our city in different ways through their eyes. This fueled a desire to create “aeiphoria” suites into the historical centre of Athens and yet far enough from the hustle and bustleat. 
The studios are exactly as described and in a superb location, in the  heart of the city.

We strongly believe that we can relate to very different types of people and help them experience Greek hospitality, giving priority to high standards of accomodation and attending to the needs and expectations of guests!

We consider each one of you our guests and not customers. 
We will be very happy to give you recommendations during your stay, in order to feel ""local"". And of course to support you when you are exploring Athens. 

Aiming to continiously improve the holiday experience of our guests....let us be your host! 
",within an hour,100%,100%,t,https://a0.muscache.com/im/pictures/user/2407bf04-7f95-4d02-8dbe-4b1ac2b9cd58.jpg?aki_policy=profile_small,https://a0.muscache.com/im/pictures/user/2407bf04-7f95-4d02-8dbe-4b1ac2b9cd58.jpg?aki_policy=profile_x_medium,,4,8,"['email', 'phone']",t,t,"Athina, Greece",ΕΜΠΟΡΙΚΟ ΤΡΙΓΩΝΟ-ΠΛΑΚΑ,,37.9813561,23.7250377,Entire rental unit,Entire home/apt,2,1.0,1 bath,1.0,1.0,"[""Freezer"", ""Clothing storage: closet"", ""Paid parking garage off premises"", ""Shower gel"", ""Elevator"", ""Mosquito net"", ""Smoke alarm"", ""Morris refrigerator"", ""Heating"", ""Coffee maker"", ""Self check-in"", ""Long term stays allowed"", ""Laundromat nearby"", ""Coffee"", ""Fire extinguisher"", ""Iron"", ""First aid kit"", ""Bed linens"", ""43 inch HDTV with standard cable"", ""Dedicated workspace"", ""Hair dryer"", ""Room-darkening shades"", ""Papoutsani shampoo"", ""Hot water"", ""Papoutsani body soap"", ""Essentials"", ""Central air conditioning"", ""Exterior security cameras on property"", ""Hot water kettle"", ""Carbon monoxide alarm"", ""Extra pillows and blankets"", ""Keypad"", ""Cleaning products"", ""Wifi"", ""Hangers""]",$76.00,1,365,1,1,365,365,1.0,365.0,,t,16,44,74,349,23/09/2024,4,2,0,14/11/2022,22/08/2024,3.75,4.0,4.25,4.25,4.25,2.25,3.25,00001660780,t,4,4,0,0,0.18
7091,762146282176047920,https://www.airbnb.com/rooms/762146282176047920,20240900000000.0,23/09/2024,city scrape,ZOIA Dinokratous | Charming 1Bed Flat in Kolonaki,"Welcome to our charming ground floor flat in the heart of Kolonaki, one of Athens' most desirable neighborhoods! Our fully equipped and furnished flat is the perfect home base for your next trip to the city.","Kolonaki is the most prime area of Athens city center, exhibiting the highest rent and occupancy levels in both residential & commercial units, with intense footfall. Embassies housed in emblematic buildings, along with some of the most historically & architecturally important buildings of Greece. Kolonaki is the most upscale area, hosting luxury branded boutiques, premium retail shops and outstanding F&B scene.",https://a0.muscache.com/pictures/miso/Hosting-762146282176047920/original/fdc46aed-fb98-426b-816b-c220aa1be97a.jpeg,488084007,https://www.airbnb.com/users/show/488084007,Zoia Living,17/11/2022,,"Indulge in the exquisite world of ZOIA living, where your housing experience transcends the mere confines of physical space.",within an hour,97%,99%,f,https://a0.muscache.com/im/pictures/user/User-488084007/original/0b7e1ec4-ca86-429d-bf68-9cc24d3393a2.jpeg?aki_policy=profile_small,https://a0.muscache.com/im/pictures/user/User-488084007/original/0b7e1ec4-ca86-429d-bf68-9cc24d3393a2.jpeg?aki_policy=profile_x_medium,,72,72,"['email', 'phone', 'work_email']",t,t,"Athina, Greece",ΛΥΚΑΒΗΤΤΟΣ,,37.9797077,23.7447585,Entire rental unit,Entire home/apt,3,1.0,1 bath,1.0,1.0,"[""Freezer"", ""TV"", ""Shower gel"", ""Clothing storage: wardrobe"", ""Kitchen"", ""Wine glasses"", ""Elevator"", ""Heating - split type ductless system"", ""Oven"", ""Electric stove"", ""Body soap"", ""Self check-in"", ""Long term stays allowed"", ""Crib - available upon request"", ""Coffee"", ""Fire extinguisher"", ""Central heating"", ""Baking sheet"", ""Free street parking"", ""Refrigerator"", ""Iron"", ""First aid kit"", ""Air conditioning"", ""Free washer \u2013 In building"", ""Toaster"", ""Bed linens"", ""Coffee maker: drip coffee maker, espresso machine, Nespresso"", ""Dining table"", ""Dedicated workspace"", ""Hair dryer"", ""Cooking basics"", ""Hot water"", ""Essentials"", ""Hot water kettle"", ""Shampoo"", ""Dishes and silverware"", ""Extra pillows and blankets"", ""Keypad"", ""Cleaning products"", ""Wifi"", ""Hangers""]",$114.00,2,365,1,2,365,365,2.0,365.0,,t,3,10,32,180,23/09/2024,3,0,0,05/07/2023,16/08/2023,3.67,3.67,3.67,3.67,3.67,3.67,3.67,00002034337,t,72,72,0,0,0.2
7122,764377698372137732,https://www.airbnb.com/rooms/764377698372137732,20240900000000.0,23/09/2024,city scrape,Friends apartment Syngrou,"In the heart of Athens, set within a short distance of Syngrou/Fix Metro Station and Acropolis Museum, Friends Apartment Syngrou offers free WiFi, air conditioning and household amenities such as a stovetop and kettle. <br />Situated on the ground floor, this apartment is fitted with 2 bedrooms, a well-equipped kitchen with a fridge and a microwave, a living room, and a flat-screen TV. Towels and bed linen are featured in the apartment.",,https://a0.muscache.com/pictures/miso/Hosting-764377698372137732/original/9afae55a-e5e6-464b-be56-bd236dabab7c.jpeg,36706129,https://www.airbnb.com/users/show/36706129,Yana,25/06/2015,"Athens, Greece","Hey!  We're Boris & Yana, a fun couple who enjoy hosting family and friends in our cozy apartment. We love to travel, so we would love to lend the comforts of home to those who are also looking to travel to one of the best cities in the world.  We are new to Airbnb, please feel free to ask any questions... what's cool, if something's missing, etc. 
Let us share our hospitality with Airbnb guests from all over the world.
HAVE FUN! :)
",within an hour,100%,100%,f,https://a0.muscache.com/im/pictures/user/84858134-bd25-41e6-97fd-096d2b0b9856.jpg?aki_policy=profile_small,https://a0.muscache.com/im/pictures/user/84858134-bd25-41e6-97fd-096d2b0b9856.jpg?aki_policy=profile_x_medium,Koukaki,5,5,"['email', 'phone']",t,t,,ΚΟΥΚΑΚΙ-ΜΑΚΡΥΓΙΑΝΝΗ,,37.96537,23.72767,Entire rental unit,Entire home/apt,6,1.0,1 bath,2.0,5.0,"[""Air conditioning"", ""Pets allowed"", ""TV"", ""Dedicated workspace"", ""Smoke alarm"", ""Fire extinguisher"", ""Kitchen"", ""Wifi""]",$55.00,3,365,3,3,365,365,3.0,365.0,,t,16,46,76,351,23/09/2024,2,1,0,02/09/2023,19/07/2024,2.5,3.0,3.5,4.0,3.0,3.0,2.5,00001782960,t,5,5,0,0,0.15
